{
  "$schema": "https://json-schema.org/draft/2020-12/schema",
  "$id": "urn:slate:schema:vault-header:2",
  "title": "Slate vault header v2 (vault.json)",
  "description": "Audit SLATE-CA-2026-10-23 §4.5.2. parseHeaderV2 (packages/desktop/src/main/vault/header.ts) accepts exactly the documents this schema accepts that also keep semantic rules 1-3: the salt decodes canonically to 16-64 bytes; fips-140-3 requires pbkdf2-hmac-sha512 and standard argon2id; history epochs are distinct and below keyEpoch. Rule 4 (64 KiB before JSON.parse) is the reader's. One deviation from the audit's listing: `check` must be the canonical base64 of 32 bytes (its last character before '=' carries no stray bits), so a header has one text per MAC. Guarded by tools/guards/headerSchema.test.ts.",
  "type": "object",
  "additionalProperties": false,
  "required": ["format", "version", "vaultId", "revision", "createdAt", "profile", "suite", "keyEpoch", "kdf", "wraps", "check"],
  "properties": {
    "format": { "const": "slate-vault" },
    "version": { "const": 2 },
    "vaultId": { "type": "string", "pattern": "^[0-9a-f]{8}-[0-9a-f]{4}-4[0-9a-f]{3}-[89ab][0-9a-f]{3}-[0-9a-f]{12}$" },
    "revision": { "type": "integer", "minimum": 1, "maximum": 9007199254740991 },
    "createdAt": { "type": "integer", "minimum": 0, "maximum": 9007199254740991 },
    "profile": { "enum": ["standard", "fips-140-3"] },
    "suite": { "const": 2 },
    "keyEpoch": { "type": "integer", "minimum": 0, "maximum": 4294967295 },
    "kdf": {
      "oneOf": [
        {
          "type": "object",
          "additionalProperties": false,
          "required": ["alg", "memoryKiB", "passes", "parallelism", "salt"],
          "properties": {
            "alg": { "const": "argon2id" },
            "memoryKiB": { "type": "integer", "minimum": 65536, "maximum": 1048576 },
            "passes": { "type": "integer", "minimum": 2, "maximum": 10 },
            "parallelism": { "const": 1 },
            "salt": { "$ref": "#/$defs/salt" }
          }
        },
        {
          "type": "object",
          "additionalProperties": false,
          "required": ["alg", "iterations", "salt"],
          "properties": {
            "alg": { "const": "pbkdf2-hmac-sha512" },
            "iterations": { "type": "integer", "minimum": 600000, "maximum": 10000000 },
            "salt": { "$ref": "#/$defs/salt" }
          }
        }
      ]
    },
    "wraps": {
      "type": "object",
      "additionalProperties": false,
      "required": ["password"],
      "properties": { "password": { "$ref": "#/$defs/wrap" }, "recovery": { "$ref": "#/$defs/wrap" } }
    },
    "history": { "type": "array", "maxItems": 4, "items": { "$ref": "#/$defs/history" } },
    "check": { "type": "string", "pattern": "^[A-Za-z0-9+/]{42}[AEIMQUYcgkosw048]=$" }
  },
  "$defs": {
    "salt": { "type": "string", "minLength": 24, "maxLength": 88, "pattern": "^(?:[A-Za-z0-9+/]{4})*(?:[A-Za-z0-9+/]{2}==|[A-Za-z0-9+/]{3}=)?$" },
    "wrap": {
      "type": "object",
      "additionalProperties": false,
      "required": ["alg", "nonce", "ct"],
      "properties": {
        "alg": { "const": "aes-256-gcm" },
        "nonce": { "type": "string", "pattern": "^[A-Za-z0-9+/]{16}$" },
        "ct": { "type": "string", "pattern": "^[A-Za-z0-9+/]{64}$" }
      }
    },
    "history": {
      "type": "object",
      "additionalProperties": false,
      "required": ["epoch", "alg", "nonce", "ct"],
      "properties": {
        "epoch": { "type": "integer", "minimum": 0, "maximum": 4294967294 },
        "alg": { "const": "aes-256-gcm" },
        "nonce": { "type": "string", "pattern": "^[A-Za-z0-9+/]{16}$" },
        "ct": { "type": "string", "pattern": "^[A-Za-z0-9+/]{64}$" }
      }
    }
  }
}
